ID,texte,titre,categorie,urgence,temps_resolution,type_ticket,nb_mots,text_full
7 669_dup_4,résolution de l'imprimante zebra résolution de l'imprimante zebra,résolution de l'imprimante zebra,Utilitaires/Incident,Moyenne,5.825,Incident,8,résolution de l'imprimante zebra résolution de l'imprimante zebra résolution de l'imprimante zebra
7 644,probléme accés a la platform ilaykom,probléme accés a la platform ilaykom,Applications,Basse,35.98,Incident,6,probléme accés a la platform ilaykom probléme accés a la platform ilaykom
6 973_dup_59,probleme de connexion wifi maphoffice off site ainsebaa,probleme de connexion wifi maphoffice off site ainsebaa,Laptop/Request,Haute,13.33,Incident,8,probleme de connexion wifi maphoffice off site ainsebaa probleme de connexion wifi maphoffice off site ainsebaa
7 159_dup_14,probleme accès ã ma base documentaire juridique editions francis lefebvre,probleme accès ã ma base documentaire juridique editions francis lefebvre,Applications,Haute,98.92,Incident,10,probleme accès ã ma base documentaire juridique editions francis lefebvre probleme accès ã ma base documentaire juridique editions francis lefebvre
7 473_dup_13,demande accès réseau de partage pv sara tebaa,demande accès réseau de partage pv sara tebaa,Autre,Moyenne,9.2,Demande,8,demande accès réseau de partage pv sara tebaa demande accès réseau de partage pv sara tebaa
7 161,demande de créer le projet flagyl ovule sur citrix 2025,demande de créer le projet flagyl ovule sur citrix 2025,Création de projet,Basse,5.825,Demande,10,demande de créer le projet flagyl ovule sur citrix 2025 demande de créer le projet flagyl ovule sur citrix 2025
7 312_dup_61,imprimante hors connexion,imprimante hors connexion,Impressions & Scanner/Incident,Haute,39.5,Incident,3,imprimante hors connexion imprimante hors connexion
7 437,failed caz_spectro_prd_std_bkp 1 machines 1 failed,failed caz_spectro_prd_std_bkp 1 machines 1 failed,Bureautique,Basse,60.07,Incident,6,failed caz_spectro_prd_std_bkp 1 machines 1 failed failed caz_spectro_prd_std_bkp 1 machines 1 failed
7 392_dup_17,téléphone fixe hors service,téléphone fixe hors service,Applications,Haute,44.27,Incident,4,téléphone fixe hors service téléphone fixe hors service
7 002,regule créer projet tanakan goutte sur citrix 2025,regule créer projet tanakan goutte sur citrix 2025,Utilitaires/Request,Basse,2.97,Demande,8,regule créer projet tanakan goutte sur citrix 2025 regule créer projet tanakan goutte sur citrix 2025
7 303,pb connexion imprimante,pb connexion imprimante,Impressions & Scanner/Incident,Basse,0.88,Incident,3,pb connexion imprimante pb connexion imprimante
7 320,demande de création d'un compte active directory pour id-malk rehab,demande de création d'un compte active directory pour id-malk rehab,Applications,Basse,8.97,Demande,10,demande de création d'un compte active directory pour id-malk rehab demande de création d'un compte active directory pour id-malk rehab
7 256_dup_12,problèmes de connexion,problèmes de connexion,Bureautique/Incident,Haute,151.17,Incident,3,problèmes de connexion problèmes de connexion
7 657_dup_9,installation souris sans fil ã sanaa bakkaddour installation de la souris sans fil via le laptop,installation souris sans fil ã sanaa bakkaddour,Accessoires/Request,Moyenne,5.825,Demande,16,installation souris sans fil ã sanaa bakkaddour installation souris sans fil ã sanaa bakkaddour installation de la souris sans fil via le laptop
7 392_dup_31,téléphone fixe hors service,téléphone fixe hors service,Applications,Haute,44.27,Incident,4,téléphone fixe hors service téléphone fixe hors service
6 973_dup_32,probleme de connexion wifi maphoffice off site ainsebaa,probleme de connexion wifi maphoffice off site ainsebaa,Laptop/Request,Haute,13.33,Incident,8,probleme de connexion wifi maphoffice off site ainsebaa probleme de connexion wifi maphoffice off site ainsebaa
7 054,problème d'accès au messagerie et au partage validation_analytique cazsfsp02,problème d'accès au messagerie et au partage validation_analytique cazsfsp02,Applications,Basse,12.85,Incident,9,problème d'accès au messagerie et au partage validation_analytique cazsfsp02 problème d'accès au messagerie et au partage validation_analytique cazsfsp02
7 575,nouvel accès fichier de partage,nouvel accès fichier de partage,Accès au partage,Basse,16.2,Demande,5,nouvel accès fichier de partage nouvel accès fichier de partage
6 924,demande de réinitialiser le mot de passe sap de othmane lhdouri,demande de réinitialiser le mot de passe sap de othmane lhdouri,MDP SAP,Basse,5.825,Demande,11,demande de réinitialiser le mot de passe sap de othmane lhdouri demande de réinitialiser le mot de passe sap de othmane lhdouri
6 997,perte des données et fichiers,perte des données et fichiers,Autre,Basse,16.0,Demande,5,perte des données et fichiers perte des données et fichiers
7 482,demande d'accès au comité de performance,demande d'accès au comité de performance,Autre,Basse,2.87,Demande,6,demande d'accès au comité de performance demande d'accès au comité de performance
7 162_dup_10,affectation d'une ligne téléphonique pour haitam kerbane,affectation d'une ligne téléphonique pour haitam kerbane,Utilitaires/Request,Moyenne,66.68,Demande,7,affectation d'une ligne téléphonique pour haitam kerbane affectation d'une ligne téléphonique pour haitam kerbane
6 929,demande de changement de bande description demande de changement de bande nom de l'application matériels bande inf supp détaillé bande téléphone emplacement et numéro de bureau site zenata ou ain sebaa,demande de changement de bande,Changement de bande,Basse,6.7,Demande,31,demande de changement de bande demande de changement de bande description demande de changement de bande nom de l'application matériels bande inf supp détaillé bande téléphone emplacement et numéro de bureau site zenata ou ain sebaa
7 665_dup_4,problème d'accès aux partages mentionnés,problème d'accès aux partages mentionnés,Autre,Moyenne,5.825,Incident,5,problème d'accès aux partages mentionnés problème d'accès aux partages mentionnés
6 973_dup_25,probleme de connexion wifi maphoffice off site ainsebaa,probleme de connexion wifi maphoffice off site ainsebaa,Laptop/Request,Haute,13.33,Incident,8,probleme de connexion wifi maphoffice off site ainsebaa probleme de connexion wifi maphoffice off site ainsebaa
7 312_dup_29,imprimante hors connexion,imprimante hors connexion,Impressions & Scanner/Incident,Haute,39.5,Incident,3,imprimante hors connexion imprimante hors connexion
7 625_dup_5,problèmes techniques sur mon pc ayoub sadkou,problèmes techniques sur mon pc ayoub sadkou,Autre,Moyenne,27.3,Incident,7,problèmes techniques sur mon pc ayoub sadkou problèmes techniques sur mon pc ayoub sadkou
7 637,njoku guy shared the folder ''2 config and build'' with you déscription njoku guy shared the folder ''2 config and build'' with you nom de l'application materiel inf supp détaillé téléphone emplacement et numéro de bureau site zenata ou ain sebaa email,njoku guy shared the folder ''2 config and build'' with you,Sécurité/Sophos,Basse,5.825,Incident,42,njoku guy shared the folder ''2 config and build'' with you njoku guy shared the folder ''2 config and build'' with you déscription njoku guy shared the folder ''2 config and build'' with you nom de l'application materiel inf supp détaillé téléphone emplacement et numéro de bureau site zenata ou ain sebaa email
7 582,acquisition d'une ligne belamghari ilham,acquisition d'une ligne belamghari ilham,Utilitaires/Request,Basse,10.27,Demande,5,acquisition d'une ligne belamghari ilham acquisition d'une ligne belamghari ilham
7 473_dup_11,demande accès réseau de partage pv sara tebaa,demande accès réseau de partage pv sara tebaa,Autre,Moyenne,9.2,Demande,8,demande accès réseau de partage pv sara tebaa demande accès réseau de partage pv sara tebaa
7 059,blocage compte sap,blocage compte sap,Compte SAP,Basse,5.825,Incident,3,blocage compte sap blocage compte sap
6 973_dup_21,probleme de connexion wifi maphoffice off site ainsebaa,probleme de connexion wifi maphoffice off site ainsebaa,Laptop/Request,Haute,13.33,Incident,8,probleme de connexion wifi maphoffice off site ainsebaa probleme de connexion wifi maphoffice off site ainsebaa
7 498_dup_3,lenteur reseau wifi depuis salle tanger,lenteur reseau wifi depuis salle tanger,Autre,Moyenne,19.67,Incident,6,lenteur reseau wifi depuis salle tanger lenteur reseau wifi depuis salle tanger
7 479,problème sur all n 11 lcq,problème sur all n 11 lcq,Connexion internet,Basse,6.53,Incident,6,problème sur all n 11 lcq problème sur all n 11 lcq
7 625_dup_4,problèmes techniques sur mon pc ayoub sadkou,problèmes techniques sur mon pc ayoub sadkou,Autre,Moyenne,27.3,Incident,7,problèmes techniques sur mon pc ayoub sadkou problèmes techniques sur mon pc ayoub sadkou
7 094,demande de donner accès ã karima saji modification lecture et écriture aux partages,demande de donner accès ã karima saji modification lecture et écriture aux partages,Accès au partage,Basse,3.48,Demande,13,demande de donner accès ã karima saji modification lecture et écriture aux partages demande de donner accès ã karima saji modification lecture et écriture aux partages
6 995,demande accès au partage securite_pub,demande accès au partage securite_pub,Accès au partage,Basse,7.45,Demande,5,demande accès au partage securite_pub demande accès au partage securite_pub
7 311,demande de créer un nouveau partage stagiaire_supply_indus sur le serveur cazsfsp02 erradi hamza,demande de créer un nouveau partage stagiaire_supply_indus sur le serveur cazsfsp02 erradi hamza,Accès au partage,Basse,1.55,Demande,13,demande de créer un nouveau partage stagiaire_supply_indus sur le serveur cazsfsp02 erradi hamza demande de créer un nouveau partage stagiaire_supply_indus sur le serveur cazsfsp02 erradi hamza
7 669,résolution de l'imprimante zebra résolution de l'imprimante zebra,résolution de l'imprimante zebra,Utilitaires/Incident,Moyenne,5.825,Incident,8,résolution de l'imprimante zebra résolution de l'imprimante zebra résolution de l'imprimante zebra
7 676_dup_9,installation microsoft office 365 via laptop de ghafir el idrissi el bachir installation microsoft office 365 via laptop de ghafir el idrissi el bachir,installation microsoft office 365 via laptop de ghafir el idrissi el bachir,Autre,Moyenne,5.825,Incident,24,installation microsoft office 365 via laptop de ghafir el idrissi el bachir installation microsoft office 365 via laptop de ghafir el idrissi el bachir installation microsoft office 365 via laptop de ghafir el idrissi el bachir
7 397,demande d'activer mon nom sur vpn,demande d'activer mon nom sur vpn,VPN,Basse,63.3,Demande,6,demande d'activer mon nom sur vpn demande d'activer mon nom sur vpn
7 310,demande d'affectation d'une ligne téléphonique pour m ismaili mohammed,demande d'affectation d'une ligne téléphonique pour m ismaili mohammed,Utilitaires/Request,Basse,31.33,Demande,9,demande d'affectation d'une ligne téléphonique pour m ismaili mohammed demande d'affectation d'une ligne téléphonique pour m ismaili mohammed
7 089,demande de créer projet allegra_cp_2025,demande de créer projet allegra_cp_2025,Création de projet,Basse,5.825,Demande,5,demande de créer projet allegra_cp_2025 demande de créer projet allegra_cp_2025
7 629,nouvel accès fichier de partage,nouvel accès fichier de partage,Accès au partage,Basse,0.55,Demande,5,nouvel accès fichier de partage nouvel accès fichier de partage
7 514,problème de fichier de partage vide,problème de fichier de partage vide,Accès au partage,Basse,20.0,Incident,6,problème de fichier de partage vide problème de fichier de partage vide
7 142,demande de création d'un compte active directory pour salma el otmani,demande de création d'un compte active directory pour salma el otmani,Création compte AD,Basse,12.28,Demande,11,demande de création d'un compte active directory pour salma el otmani demande de création d'un compte active directory pour salma el otmani
7 264,regule demande d'augmenter la taille du projet locatop_2025 développement,regule demande d'augmenter la taille du projet locatop_2025 développement,Augmentation de taille,Basse,18.1,Demande,9,regule demande d'augmenter la taille du projet locatop_2025 développement regule demande d'augmenter la taille du projet locatop_2025 développement
7 159_dup_40,probleme accès ã ma base documentaire juridique editions francis lefebvre,probleme accès ã ma base documentaire juridique editions francis lefebvre,Applications,Haute,98.92,Incident,10,probleme accès ã ma base documentaire juridique editions francis lefebvre probleme accès ã ma base documentaire juridique editions francis lefebvre
7 256_dup_11,problèmes de connexion,problèmes de connexion,Bureautique/Incident,Haute,151.17,Incident,3,problèmes de connexion problèmes de connexion
7 630,demande de changement de mot de passe cfao,demande de changement de mot de passe cfao,MDP CFAO,Basse,0.72,Demande,8,demande de changement de mot de passe cfao demande de changement de mot de passe cfao
7 549,problème d'accès au portail ilaykom,problème d'accès au portail ilaykom,Connexion internet,Basse,22.0,Incident,5,problème d'accès au portail ilaykom problème d'accès au portail ilaykom
7 256_dup_18,problèmes de connexion,problèmes de connexion,Bureautique/Incident,Haute,151.17,Incident,3,problèmes de connexion problèmes de connexion
7 625,problèmes techniques sur mon pc ayoub sadkou,problèmes techniques sur mon pc ayoub sadkou,Autre,Moyenne,27.3,Incident,7,problèmes techniques sur mon pc ayoub sadkou problèmes techniques sur mon pc ayoub sadkou
6 973_dup_12,probleme de connexion wifi maphoffice off site ainsebaa,probleme de connexion wifi maphoffice off site ainsebaa,Laptop/Request,Haute,13.33,Incident,8,probleme de connexion wifi maphoffice off site ainsebaa probleme de connexion wifi maphoffice off site ainsebaa
7 498_dup_1,lenteur reseau wifi depuis salle tanger,lenteur reseau wifi depuis salle tanger,Autre,Moyenne,19.67,Incident,6,lenteur reseau wifi depuis salle tanger lenteur reseau wifi depuis salle tanger
7 256_dup_8,problèmes de connexion,problèmes de connexion,Bureautique/Incident,Haute,151.17,Incident,3,problèmes de connexion problèmes de connexion
7 653_dup_5,installation microsoft office 365 installation de microsoft office 356 via le pc de mohamed eddahar,installation microsoft office 365,Activation office,Moyenne,5.825,Demande,15,installation microsoft office 365 installation microsoft office 365 installation de microsoft office 356 via le pc de mohamed eddahar
7 159_dup_17,probleme accès ã ma base documentaire juridique editions francis lefebvre,probleme accès ã ma base documentaire juridique editions francis lefebvre,Applications,Haute,98.92,Incident,10,probleme accès ã ma base documentaire juridique editions francis lefebvre probleme accès ã ma base documentaire juridique editions francis lefebvre
7 657_dup_1,installation souris sans fil ã sanaa bakkaddour installation de la souris sans fil via le laptop,installation souris sans fil ã sanaa bakkaddour,Accessoires/Request,Moyenne,5.825,Demande,16,installation souris sans fil ã sanaa bakkaddour installation souris sans fil ã sanaa bakkaddour installation de la souris sans fil via le laptop
7 256_dup_15,problèmes de connexion,problèmes de connexion,Bureautique/Incident,Haute,151.17,Incident,3,problèmes de connexion problèmes de connexion
7 313,revue périodique du système truscan - mesures de protection de l'audit trail,revue périodique du système truscan - mesures de protection de l'audit trail,Sauvegarde,Basse,9.25,Demande,12,revue périodique du système truscan - mesures de protection de l'audit trail revue périodique du système truscan - mesures de protection de l'audit trail
6 986,demande de création compte ad pour mm abouzid wiam,demande de création compte ad pour mm abouzid wiam,Création compte AD,Basse,10.15,Demande,9,demande de création compte ad pour mm abouzid wiam demande de création compte ad pour mm abouzid wiam
6 977,demande de création compte ad pour tarnoun chaimaa,demande de création compte ad pour tarnoun chaimaa,Création compte AD,Basse,12.32,Demande,8,demande de création compte ad pour tarnoun chaimaa demande de création compte ad pour tarnoun chaimaa
7 072,demande de changement de bande description demande de changement de bande nom de l'application matériels bande inf supp détaillé bande téléphone emplacement et numéro de bureau site zenata ou ain sebaa,demande de changement de bande,Changement de bande,Basse,6.07,Demande,31,demande de changement de bande demande de changement de bande description demande de changement de bande nom de l'application matériels bande inf supp détaillé bande téléphone emplacement et numéro de bureau site zenata ou ain sebaa
7 480_dup_48,problème borne ilaykom prod primaire bonjour je vous prie de noter que la borne primaire de la production ne fonctionne pas merci d'intervenir,problème borne ilaykom prod primaire,Applications,Haute,4.32,Incident,23,problème borne ilaykom prod primaire problème borne ilaykom prod primaire bonjour je vous prie de noter que la borne primaire de la production ne fonctionne pas merci d'intervenir
7 538,compte ad en double,compte ad en double,Compte AD,Basse,2.0,Demande,4,compte ad en double compte ad en double
7 656_dup_3,demande d'activation section partage validation analytique driss el bekkali,demande d'activation section partage validation analytique driss el bekkali,Autre,Moyenne,5.825,Demande,9,demande d'activation section partage validation analytique driss el bekkali demande d'activation section partage validation analytique driss el bekkali
7 240,partage projets industriels_qualité,partage projets industriels_qualité,Accès au partage,Basse,20.97,Demande,3,partage projets industriels_qualité partage projets industriels_qualité
7 370,demande de donner l'accès lecture et modification au fp cazsfsp02 qualité supply chain 2 ã mohammed ismaili mohammed ismaili maphar ma,demande de donner l'accès lecture et modification au fp cazsfsp02 qualité supply chain 2 ã mohammed ismaili mohammed ismaili maphar ma,Accès au partage,Basse,1.83,Demande,21,demande de donner l'accès lecture et modification au fp cazsfsp02 qualité supply chain 2 ã mohammed ismaili mohammed ismaili maphar ma demande de donner l'accès lecture et modification au fp cazsfsp02 qualité supply chain 2 ã mohammed ismaili mohammed ismaili maphar ma
7 544_dup_3,completer la configuration du nouveau laptop de mohcine ouajji compléter la configuration du nouveau laptop destiné ã m mohcine,completer la configuration du nouveau laptop de mohcine ouajji,Autre,Moyenne,47.45,Incident,19,completer la configuration du nouveau laptop de mohcine ouajji completer la configuration du nouveau laptop de mohcine ouajji compléter la configuration du nouveau laptop destiné ã m mohcine
7 256_dup_25,problèmes de connexion,problèmes de connexion,Bureautique/Incident,Haute,151.17,Incident,3,problèmes de connexion problèmes de connexion
7 498_dup_16,lenteur reseau wifi depuis salle tanger,lenteur reseau wifi depuis salle tanger,Autre,Moyenne,19.67,Incident,6,lenteur reseau wifi depuis salle tanger lenteur reseau wifi depuis salle tanger
7 498_dup_6,lenteur reseau wifi depuis salle tanger,lenteur reseau wifi depuis salle tanger,Autre,Moyenne,19.67,Incident,6,lenteur reseau wifi depuis salle tanger lenteur reseau wifi depuis salle tanger
7 206,problème cable hdmi,problème cable hdmi,Réseau / Connexion internet,Basse,29.55,Incident,3,problème cable hdmi problème cable hdmi
7 647_dup_7,problème d'accès ã hfm_https hfm cdg ma workspace index jsp labazi saad,problème d'accès ã hfm_https hfm cdg ma workspace index jsp labazi saad,Autre,Moyenne,0.58,Incident,12,problème d'accès ã hfm_https hfm cdg ma workspace index jsp labazi saad problème d'accès ã hfm_https hfm cdg ma workspace index jsp labazi saad
7 282,anommalie fichier de partage,anommalie fichier de partage,Accès au partage,Basse,20.72,Incident,4,anommalie fichier de partage anommalie fichier de partage
7 392_dup_29,téléphone fixe hors service,téléphone fixe hors service,Applications,Haute,44.27,Incident,4,téléphone fixe hors service téléphone fixe hors service
7 392_dup_15,téléphone fixe hors service,téléphone fixe hors service,Applications,Haute,44.27,Incident,4,téléphone fixe hors service téléphone fixe hors service
7 655_dup_2,installation souris sans fil ã bouchra eljamii installation de la souris sans fil ã bouchra eljamii,installation souris sans fil ã bouchra eljamii,Accessoires/Request,Moyenne,19.33,Demande,16,installation souris sans fil ã bouchra eljamii installation souris sans fil ã bouchra eljamii installation de la souris sans fil ã bouchra eljamii
7 288,régularisation demande de créer le projet teca_mp_2025 sur répertoire dev,régularisation demande de créer le projet teca_mp_2025 sur répertoire dev,Création de projet,Basse,5.825,Demande,10,régularisation demande de créer le projet teca_mp_2025 sur répertoire dev régularisation demande de créer le projet teca_mp_2025 sur répertoire dev
6 938,probléme d'accès session windows m ismail aitidir,probléme d'accès session windows m ismail aitidir,accès Windows,Basse,6.38,Incident,7,probléme d'accès session windows m ismail aitidir probléme d'accès session windows m ismail aitidir
7 496_dup_6,demande matériel informatique aya dhissi,demande matériel informatique aya dhissi,Autre,Moyenne,23.9,Demande,5,demande matériel informatique aya dhissi demande matériel informatique aya dhissi
7 433,demande de donner accès partage ã khadija bennani l'accès en lecture modification cazsfsp02 support_qualité_rh,demande de donner accès partage ã khadija bennani l'accès en lecture modification cazsfsp02 support_qualité_rh,Autre,Basse,5.35,Demande,14,demande de donner accès partage ã khadija bennani l'accès en lecture modification cazsfsp02 support_qualité_rh demande de donner accès partage ã khadija bennani l'accès en lecture modification cazsfsp02 support_qualité_rh
7 665_dup_2,problème d'accès aux partages mentionnés,problème d'accès aux partages mentionnés,Autre,Moyenne,5.825,Incident,5,problème d'accès aux partages mentionnés problème d'accès aux partages mentionnés
7 663_dup_4,mot de passe cfao réinitialisé pour céline fournier mot de passe cfao réinitialisé pour céline fournier,mot de passe cfao réinitialisé pour céline fournier,MDP CFAO,Moyenne,5.825,Demande,16,mot de passe cfao réinitialisé pour céline fournier mot de passe cfao réinitialisé pour céline fournier mot de passe cfao réinitialisé pour céline fournier
7 289,régularisation demande de créer le projet mycoster crème sweft,régularisation demande de créer le projet mycoster crème sweft,Création de projet,Basse,5.825,Demande,9,régularisation demande de créer le projet mycoster crème sweft régularisation demande de créer le projet mycoster crème sweft
7 170,demande d'l'accès au partage réseau avec les droits de lecture et de modification mme salma el otmani,demande d'l'accès au partage réseau avec les droits de lecture et de modification mme salma el otmani,Accès au partage,Basse,11.95,Demande,17,demande d'l'accès au partage réseau avec les droits de lecture et de modification mme salma el otmani demande d'l'accès au partage réseau avec les droits de lecture et de modification mme salma el otmani
7 676_dup_15,installation microsoft office 365 via laptop de ghafir el idrissi el bachir installation microsoft office 365 via laptop de ghafir el idrissi el bachir,installation microsoft office 365 via laptop de ghafir el idrissi el bachir,Autre,Moyenne,5.825,Incident,24,installation microsoft office 365 via laptop de ghafir el idrissi el bachir installation microsoft office 365 via laptop de ghafir el idrissi el bachir installation microsoft office 365 via laptop de ghafir el idrissi el bachir
7 058,demande de créer le partage cazsfsp02 sorbonnes_lcq et donner l'accès en lecture écriture aux users cis-dessous,demande de créer le partage cazsfsp02 sorbonnes_lcq et donner l'accès en lecture écriture aux users cis-dessous,Accès au partage,Basse,3.45,Demande,16,demande de créer le partage cazsfsp02 sorbonnes_lcq et donner l'accès en lecture écriture aux users cis-dessous demande de créer le partage cazsfsp02 sorbonnes_lcq et donner l'accès en lecture écriture aux users cis-dessous
7 531,demande de donner accès au partage cazsfsp02 validation analytique,demande de donner accès au partage cazsfsp02 validation analytique,Accès au partage,Basse,21.78,Demande,9,demande de donner accès au partage cazsfsp02 validation analytique demande de donner accès au partage cazsfsp02 validation analytique
7 010,régularisation demande de créer le projet de toplexil sirop 2025,régularisation demande de créer le projet de toplexil sirop 2025,Création de projet,Basse,5.825,Demande,10,régularisation demande de créer le projet de toplexil sirop 2025 régularisation demande de créer le projet de toplexil sirop 2025
7 642,demande d'accorder les droits de lecture et de modification sur le chemin suivant cazsfsp02 comité_performance,demande d'accorder les droits de lecture et de modification sur le chemin suivant cazsfsp02 comité_performance,Accès au partage,Basse,1.55,Demande,15,demande d'accorder les droits de lecture et de modification sur le chemin suivant cazsfsp02 comité_performance demande d'accorder les droits de lecture et de modification sur le chemin suivant cazsfsp02 comité_performance
7 517,problème impression zebra,problème impression zebra,Impressions & Scanner,Basse,5.825,Incident,3,problème impression zebra problème impression zebra
