ID,texte,titre,categorie,urgence,temps_resolution,type_ticket,nb_mots,text_full
7 392_dup_40,téléphone fixe hors service,téléphone fixe hors service,Applications,Haute,44.27,Incident,4,téléphone fixe hors service téléphone fixe hors service
7 392_dup_19,téléphone fixe hors service,téléphone fixe hors service,Applications,Haute,44.27,Incident,4,téléphone fixe hors service téléphone fixe hors service
7 670_dup_9,problème boite outlook pour benmoussa deyaa problème boite outlook benmoussa deyaa,problème boite outlook pour benmoussa deyaa,Activation office,Moyenne,5.825,Incident,11,problème boite outlook pour benmoussa deyaa problème boite outlook pour benmoussa deyaa problème boite outlook benmoussa deyaa
7 558_dup_2,demande d' accès partage marouane aaffale,demande d' accès partage marouane aaffale,Autre,Moyenne,1.23,Demande,6,demande d' accès partage marouane aaffale demande d' accès partage marouane aaffale
7 455,problème de connexion au niveau des cobalts des enceintes climatiques lcq,problème de connexion au niveau des cobalts des enceintes climatiques lcq,Connexion internet,Basse,31.25,Incident,11,problème de connexion au niveau des cobalts des enceintes climatiques lcq problème de connexion au niveau des cobalts des enceintes climatiques lcq
7 677_dup_3,compte windows est verrouillé pour youssef bahaddi déverrouillage du compte windows pour youssef bahaddi,compte windows est verrouillé pour youssef bahaddi,Autre,Moyenne,5.825,Incident,14,compte windows est verrouillé pour youssef bahaddi compte windows est verrouillé pour youssef bahaddi déverrouillage du compte windows pour youssef bahaddi
7 095,demande d'ajout au partage cassfsp01 stg_business,demande d'ajout au partage cassfsp01 stg_business,Accès au partage,Basse,2.55,Demande,6,demande d'ajout au partage cassfsp01 stg_business demande d'ajout au partage cassfsp01 stg_business
7 685,demande de création compte ad el maslahi azzedine demande demande de création compte ad el maslahi azzedine nom de l'application materiel inf supp détaillé téléphone emplacement et numéro de bureau site zenata ou ain sebaa email,demande de création compte ad el maslahi azzedine,Compte AD,Basse,5.825,Demande,36,demande de création compte ad el maslahi azzedine demande de création compte ad el maslahi azzedine demande demande de création compte ad el maslahi azzedine nom de l'application materiel inf supp détaillé téléphone emplacement et numéro de bureau site zenata ou ain sebaa email
6 954,failed caz_wtruescan_prd_std_bkp 1 machines 1 failed,failed caz_wtruescan_prd_std_bkp 1 machines 1 failed,Sauvegarde,Basse,9.45,Incident,6,failed caz_wtruescan_prd_std_bkp 1 machines 1 failed failed caz_wtruescan_prd_std_bkp 1 machines 1 failed
6 922,demande de créer les projets suivants dans le répertoire dev citrix,demande de créer les projets suivants dans le répertoire dev citrix,Création de projet,Basse,5.825,Demande,11,demande de créer les projets suivants dans le répertoire dev citrix demande de créer les projets suivants dans le répertoire dev citrix
7 657_dup_6,installation souris sans fil ã sanaa bakkaddour installation de la souris sans fil via le laptop,installation souris sans fil ã sanaa bakkaddour,Accessoires/Request,Moyenne,5.825,Demande,16,installation souris sans fil ã sanaa bakkaddour installation souris sans fil ã sanaa bakkaddour installation de la souris sans fil via le laptop
7 287,probléme d'accés au partage,probléme d'accés au partage,Accès au partage,Basse,10.92,Incident,4,probléme d'accés au partage probléme d'accés au partage
7 618,demande de de donner l'accès ã mina ã tous les dossiers du fichier de partage gestion_suivi_produits_amc,demande de de donner l'accès ã mina ã tous les dossiers du fichier de partage gestion_suivi_produits_amc,Accès au partage,Basse,22.85,Demande,16,demande de de donner l'accès ã mina ã tous les dossiers du fichier de partage gestion_suivi_produits_amc demande de de donner l'accès ã mina ã tous les dossiers du fichier de partage gestion_suivi_produits_amc
7 558_dup_6,demande d' accès partage marouane aaffale,demande d' accès partage marouane aaffale,Autre,Moyenne,1.23,Demande,6,demande d' accès partage marouane aaffale demande d' accès partage marouane aaffale
7 480_dup_42,problème borne ilaykom prod primaire bonjour je vous prie de noter que la borne primaire de la production ne fonctionne pas merci d'intervenir,problème borne ilaykom prod primaire,Applications,Haute,4.32,Incident,23,problème borne ilaykom prod primaire problème borne ilaykom prod primaire bonjour je vous prie de noter que la borne primaire de la production ne fonctionne pas merci d'intervenir
7 676_dup_5,installation microsoft office 365 via laptop de ghafir el idrissi el bachir installation microsoft office 365 via laptop de ghafir el idrissi el bachir,installation microsoft office 365 via laptop de ghafir el idrissi el bachir,Autre,Moyenne,5.825,Incident,24,installation microsoft office 365 via laptop de ghafir el idrissi el bachir installation microsoft office 365 via laptop de ghafir el idrissi el bachir installation microsoft office 365 via laptop de ghafir el idrissi el bachir
7 656_dup_5,demande d'activation section partage validation analytique driss el bekkali,demande d'activation section partage validation analytique driss el bekkali,Autre,Moyenne,5.825,Demande,9,demande d'activation section partage validation analytique driss el bekkali demande d'activation section partage validation analytique driss el bekkali
7 569,problème imprimante ma15 le 26 06 2025,problème imprimante ma15 le 26 06 2025,Impressions & Scanner/Incident,Basse,4.95,Incident,7,problème imprimante ma15 le 26 06 2025 problème imprimante ma15 le 26 06 2025
6 988,création compte ad_taleb elmehdi,création compte ad_taleb elmehdi,Création compte AD,Basse,9.12,Demande,4,création compte ad_taleb elmehdi création compte ad_taleb elmehdi
7 392_dup_32,téléphone fixe hors service,téléphone fixe hors service,Applications,Haute,44.27,Incident,4,téléphone fixe hors service téléphone fixe hors service
6 973_dup_20,probleme de connexion wifi maphoffice off site ainsebaa,probleme de connexion wifi maphoffice off site ainsebaa,Laptop/Request,Haute,13.33,Incident,8,probleme de connexion wifi maphoffice off site ainsebaa probleme de connexion wifi maphoffice off site ainsebaa
7 454,problème d'accès au partage comptabilité,problème d'accès au partage comptabilité,Accès au partage,Basse,24.1,Incident,5,problème d'accès au partage comptabilité problème d'accès au partage comptabilité
7 494,probleme pc,probleme pc,Autre,Basse,3.47,Incident,2,probleme pc probleme pc
7 480_dup_35,problème borne ilaykom prod primaire bonjour je vous prie de noter que la borne primaire de la production ne fonctionne pas merci d'intervenir,problème borne ilaykom prod primaire,Applications,Haute,4.32,Incident,23,problème borne ilaykom prod primaire problème borne ilaykom prod primaire bonjour je vous prie de noter que la borne primaire de la production ne fonctionne pas merci d'intervenir
7 149,régularisation compte sap bloqué,régularisation compte sap bloqué,accès SAP,Basse,5.825,Incident,4,régularisation compte sap bloqué régularisation compte sap bloqué
7 162_dup_5,affectation d'une ligne téléphonique pour haitam kerbane,affectation d'une ligne téléphonique pour haitam kerbane,Utilitaires/Request,Moyenne,66.68,Demande,7,affectation d'une ligne téléphonique pour haitam kerbane affectation d'une ligne téléphonique pour haitam kerbane
7 672_dup_9,problème de okta pour kawtar zraidi problème de okta pour kawtar zraidi,problème de okta pour kawtar zraidi,MDP CFAO,Moyenne,5.825,Incident,12,problème de okta pour kawtar zraidi problème de okta pour kawtar zraidi problème de okta pour kawtar zraidi
7 082,problème connexion wifi maphoffice,problème connexion wifi maphoffice,Réseau / Connexion internet,Basse,17.67,Incident,4,problème connexion wifi maphoffice problème connexion wifi maphoffice
7 400,demande de création d'un compte active directory pour kinani youssef,demande de création d'un compte active directory pour kinani youssef,Accès au partage,Basse,0.47,Demande,10,demande de création d'un compte active directory pour kinani youssef demande de création d'un compte active directory pour kinani youssef
7 006,arrêt vignetteuse automatique,arrêt vignetteuse automatique,Impressions & Scanner/Incident,Basse,35.8,Incident,3,arrêt vignetteuse automatique arrêt vignetteuse automatique
7 661_dup_8,accès au partage pour omaima najim accès au partage pour omaima najim,accès au partage pour omaima najim,Accès au partage,Moyenne,5.825,Demande,12,accès au partage pour omaima najim accès au partage pour omaima najim accès au partage pour omaima najim
7 480_dup_25,problème borne ilaykom prod primaire bonjour je vous prie de noter que la borne primaire de la production ne fonctionne pas merci d'intervenir,problème borne ilaykom prod primaire,Applications,Haute,4.32,Incident,23,problème borne ilaykom prod primaire problème borne ilaykom prod primaire bonjour je vous prie de noter que la borne primaire de la production ne fonctionne pas merci d'intervenir
7 312_dup_62,imprimante hors connexion,imprimante hors connexion,Impressions & Scanner/Incident,Haute,39.5,Incident,3,imprimante hors connexion imprimante hors connexion
7 203,imprimante en arrêt,imprimante en arrêt,Impressions & Scanner,Basse,4.38,Incident,3,imprimante en arrêt imprimante en arrêt
7 256_dup_9,problèmes de connexion,problèmes de connexion,Bureautique/Incident,Haute,151.17,Incident,3,problèmes de connexion problèmes de connexion
7 159_dup_39,probleme accès ã ma base documentaire juridique editions francis lefebvre,probleme accès ã ma base documentaire juridique editions francis lefebvre,Applications,Haute,98.92,Incident,10,probleme accès ã ma base documentaire juridique editions francis lefebvre probleme accès ã ma base documentaire juridique editions francis lefebvre
7 474,probléme d'accés citrix,probléme d'accés citrix,Applications,Basse,0.87,Incident,3,probléme d'accés citrix probléme d'accés citrix
7 622,demande d'accorder ã zineb katoui les droits de modification sur les chemins suivant cassfsp01 ao_maphar et cassfsp01 suivi_administrations,demande d'accorder ã zineb katoui les droits de modification sur les chemins suivant cassfsp01 ao_maphar et cassfsp01 suivi_administrations,Accès au partage,Basse,2.38,Demande,18,demande d'accorder ã zineb katoui les droits de modification sur les chemins suivant cassfsp01 ao_maphar et cassfsp01 suivi_administrations demande d'accorder ã zineb katoui les droits de modification sur les chemins suivant cassfsp01 ao_maphar et cassfsp01 suivi_administrations
7 051,prbléme d'accés partage validation_analytique cazsfsp02,prbléme d'accés partage validation_analytique cazsfsp02,Partage,Basse,14.43,Incident,5,prbléme d'accés partage validation_analytique cazsfsp02 prbléme d'accés partage validation_analytique cazsfsp02
7 670_dup_15,problème boite outlook pour benmoussa deyaa problème boite outlook benmoussa deyaa,problème boite outlook pour benmoussa deyaa,Activation office,Moyenne,5.825,Incident,11,problème boite outlook pour benmoussa deyaa problème boite outlook pour benmoussa deyaa problème boite outlook benmoussa deyaa
7 140,demande de changement de bande description demande de changement de bande nom de l'application matériels banbde inf supp détaillé bande téléphone emplacement et numéro de bureau site zenata ou ain sebaa,demande de changement de bande,Changement de bande,Basse,11.02,Demande,31,demande de changement de bande demande de changement de bande description demande de changement de bande nom de l'application matériels banbde inf supp détaillé bande téléphone emplacement et numéro de bureau site zenata ou ain sebaa
6 952,mot de passe citrix amal sanaa,mot de passe citrix amal sanaa,Applications,Basse,5.825,Incident,6,mot de passe citrix amal sanaa mot de passe citrix amal sanaa
7 658_dup_10,installation windows 11 installation office 365 pour omaima najim installation windows 11 installation office 365 pour omaima najim,installation windows 11 installation office 365 pour omaima najim,MAJ system,Moyenne,9.83,Demande,18,installation windows 11 installation office 365 pour omaima najim installation windows 11 installation office 365 pour omaima najim installation windows 11 installation office 365 pour omaima najim
7 539,demande de création d'un compte active directory pour touhair yasmine,demande de création d'un compte active directory pour touhair yasmine,Création compte AD,Basse,1.4,Demande,10,demande de création d'un compte active directory pour touhair yasmine demande de création d'un compte active directory pour touhair yasmine
7 676_dup_3,installation microsoft office 365 via laptop de ghafir el idrissi el bachir installation microsoft office 365 via laptop de ghafir el idrissi el bachir,installation microsoft office 365 via laptop de ghafir el idrissi el bachir,Autre,Moyenne,5.825,Incident,24,installation microsoft office 365 via laptop de ghafir el idrissi el bachir installation microsoft office 365 via laptop de ghafir el idrissi el bachir installation microsoft office 365 via laptop de ghafir el idrissi el bachir
7 669_dup_3,résolution de l'imprimante zebra résolution de l'imprimante zebra,résolution de l'imprimante zebra,Utilitaires/Incident,Moyenne,5.825,Incident,8,résolution de l'imprimante zebra résolution de l'imprimante zebra résolution de l'imprimante zebra
7 411,failed caz_wtexturo_prd_std_bkp 1 machines 1 failed,failed caz_wtexturo_prd_std_bkp 1 machines 1 failed,Applications,Basse,131.37,Incident,6,failed caz_wtexturo_prd_std_bkp 1 machines 1 failed failed caz_wtexturo_prd_std_bkp 1 machines 1 failed
6 973_dup_37,probleme de connexion wifi maphoffice off site ainsebaa,probleme de connexion wifi maphoffice off site ainsebaa,Laptop/Request,Haute,13.33,Incident,8,probleme de connexion wifi maphoffice off site ainsebaa probleme de connexion wifi maphoffice off site ainsebaa
7 663_dup_2,mot de passe cfao réinitialisé pour céline fournier mot de passe cfao réinitialisé pour céline fournier,mot de passe cfao réinitialisé pour céline fournier,MDP CFAO,Moyenne,5.825,Demande,16,mot de passe cfao réinitialisé pour céline fournier mot de passe cfao réinitialisé pour céline fournier mot de passe cfao réinitialisé pour céline fournier
7 081,demande de créer le projet contalax cp sur citirx,demande de créer le projet contalax cp sur citirx,Création de projet,Basse,5.825,Demande,9,demande de créer le projet contalax cp sur citirx demande de créer le projet contalax cp sur citirx
7 291,accées partage instruction_de_fabrication_t hamam,accées partage instruction_de_fabrication_t hamam,Accès au partage,Basse,1.25,Demande,4,accées partage instruction_de_fabrication_t hamam accées partage instruction_de_fabrication_t hamam
7 364,regule créer le projet duspatalin gélule et no duspatalin 200mg cp sur citrix 2025,regule créer le projet duspatalin gélule et no duspatalin 200mg cp sur citrix 2025,Autre,Basse,6.52,Demande,14,regule créer le projet duspatalin gélule et no duspatalin 200mg cp sur citrix 2025 regule créer le projet duspatalin gélule et no duspatalin 200mg cp sur citrix 2025
7 502,pb imprimante ma95 service export,pb imprimante ma95 service export,Impressions & Scanner/Incident,Basse,3.07,Incident,5,pb imprimante ma95 service export pb imprimante ma95 service export
7 467_dup_6,pb bornes zenata pour mme asmae chadli,pb bornes zenata pour mme asmae chadli,Autre,Moyenne,23.07,Incident,7,pb bornes zenata pour mme asmae chadli pb bornes zenata pour mme asmae chadli
7 028,demande de creation de projet de profénid gélule,demande de creation de projet de profénid gélule,Création de projet,Basse,5.825,Demande,8,demande de creation de projet de profénid gélule demande de creation de projet de profénid gélule
7 014,demande de donner accès au partage cazsfsp02 comité_performance pour khalid benjabli en r w,demande de donner accès au partage cazsfsp02 comité_performance pour khalid benjabli en r w,Accès au partage,Basse,9.42,Demande,14,demande de donner accès au partage cazsfsp02 comité_performance pour khalid benjabli en r w demande de donner accès au partage cazsfsp02 comité_performance pour khalid benjabli en r w
7 480_dup_16,problème borne ilaykom prod primaire bonjour je vous prie de noter que la borne primaire de la production ne fonctionne pas merci d'intervenir,problème borne ilaykom prod primaire,Applications,Haute,4.32,Incident,23,problème borne ilaykom prod primaire problème borne ilaykom prod primaire bonjour je vous prie de noter que la borne primaire de la production ne fonctionne pas merci d'intervenir
7 564,recuperation du fichier supprime,recuperation du fichier supprime,Bureautique,Basse,27.12,Demande,4,recuperation du fichier supprime recuperation du fichier supprime
7 498_dup_13,lenteur reseau wifi depuis salle tanger,lenteur reseau wifi depuis salle tanger,Autre,Moyenne,19.67,Incident,6,lenteur reseau wifi depuis salle tanger lenteur reseau wifi depuis salle tanger
7 558_dup_7,demande d' accès partage marouane aaffale,demande d' accès partage marouane aaffale,Autre,Moyenne,1.23,Demande,6,demande d' accès partage marouane aaffale demande d' accès partage marouane aaffale
6 973_dup_13,probleme de connexion wifi maphoffice off site ainsebaa,probleme de connexion wifi maphoffice off site ainsebaa,Laptop/Request,Haute,13.33,Incident,8,probleme de connexion wifi maphoffice off site ainsebaa probleme de connexion wifi maphoffice off site ainsebaa
7 627,demande créer un nouveau partage activité_lcq sur le serveur cazsfsp02,demande créer un nouveau partage activité_lcq sur le serveur cazsfsp02,Accès au partage,Basse,2.03,Demande,10,demande créer un nouveau partage activité_lcq sur le serveur cazsfsp02 demande créer un nouveau partage activité_lcq sur le serveur cazsfsp02
6 958,demande de changement de bande description demande de changement de bande nom de l'application matériels bande inf supp détaillé bande téléphone emplacement et numéro de bureau site zenata ou ain seaa,demande de changement de bande,Changement de bande,Basse,2.35,Demande,31,demande de changement de bande demande de changement de bande description demande de changement de bande nom de l'application matériels bande inf supp détaillé bande téléphone emplacement et numéro de bureau site zenata ou ain seaa
7 248,demande de création compte ad pour mme elghali basmaa,demande de création compte ad pour mme elghali basmaa,Création compte AD,Basse,2.47,Demande,9,demande de création compte ad pour mme elghali basmaa demande de création compte ad pour mme elghali basmaa
6 959,demande d'attribuer l'accès au partage ci-dessous ã mlle bouchra el jamii en lecture et écriture,demande d'attribuer l'accès au partage ci-dessous ã mlle bouchra el jamii en lecture et écriture,Accès au partage,Basse,6.2,Demande,15,demande d'attribuer l'accès au partage ci-dessous ã mlle bouchra el jamii en lecture et écriture demande d'attribuer l'accès au partage ci-dessous ã mlle bouchra el jamii en lecture et écriture
6 973_dup_43,probleme de connexion wifi maphoffice off site ainsebaa,probleme de connexion wifi maphoffice off site ainsebaa,Laptop/Request,Haute,13.33,Incident,8,probleme de connexion wifi maphoffice off site ainsebaa probleme de connexion wifi maphoffice off site ainsebaa
7 660,fichier word et excel,fichier word et excel,Bureautique/Incident,Basse,5.825,Incident,4,fichier word et excel fichier word et excel
7 422,demande de désactiver le compte ad en fin de journée,demande de désactiver le compte ad en fin de journée,Compte AD désactivation,Basse,6.63,Demande,10,demande de désactiver le compte ad en fin de journée demande de désactiver le compte ad en fin de journée
7 677_dup_11,compte windows est verrouillé pour youssef bahaddi déverrouillage du compte windows pour youssef bahaddi,compte windows est verrouillé pour youssef bahaddi,Autre,Moyenne,5.825,Incident,14,compte windows est verrouillé pour youssef bahaddi compte windows est verrouillé pour youssef bahaddi déverrouillage du compte windows pour youssef bahaddi
7 552,demande de réinitialisation mot de passe cfao,demande de réinitialisation mot de passe cfao,MDP CFAO,Basse,0.18,Demande,7,demande de réinitialisation mot de passe cfao demande de réinitialisation mot de passe cfao
7 316,demande d'accès en lecture seule au dossier delais_t hamam du partage '' qualite_pub cazsfsp01 ã amine,demande d'accès en lecture seule au dossier delais_t hamam du partage '' qualite_pub cazsfsp01 ã amine,Accès au partage,Basse,16.45,Demande,16,demande d'accès en lecture seule au dossier delais_t hamam du partage '' qualite_pub cazsfsp01 ã amine demande d'accès en lecture seule au dossier delais_t hamam du partage '' qualite_pub cazsfsp01 ã amine
7 568,pb acces bloque partage aqp maphar,pb acces bloque partage aqp maphar,Accès au partage,Basse,18.37,Incident,6,pb acces bloque partage aqp maphar pb acces bloque partage aqp maphar
7 429,demande de acquisition d'une ligne berhoumi souhaila,demande de acquisition d'une ligne berhoumi souhaila,Autre,Basse,29.42,Demande,7,demande de acquisition d'une ligne berhoumi souhaila demande de acquisition d'une ligne berhoumi souhaila
7 626,problème microsoft outlook,problème microsoft outlook,Bureautique/Incident,Basse,14.32,Incident,3,problème microsoft outlook problème microsoft outlook
7 162_dup_8,affectation d'une ligne téléphonique pour haitam kerbane,affectation d'une ligne téléphonique pour haitam kerbane,Utilitaires/Request,Moyenne,66.68,Demande,7,affectation d'une ligne téléphonique pour haitam kerbane affectation d'une ligne téléphonique pour haitam kerbane
7 593,installation windows pour sap sanofi,installation windows pour sap sanofi,accès Windows,Basse,0.83,Demande,5,installation windows pour sap sanofi installation windows pour sap sanofi
7 480_dup_28,problème borne ilaykom prod primaire bonjour je vous prie de noter que la borne primaire de la production ne fonctionne pas merci d'intervenir,problème borne ilaykom prod primaire,Applications,Haute,4.32,Incident,23,problème borne ilaykom prod primaire problème borne ilaykom prod primaire bonjour je vous prie de noter que la borne primaire de la production ne fonctionne pas merci d'intervenir
7 668_dup_8,mot de passe cfao réinitialisé pour céline fournier mot de passe cfao réinitialisé pour céline fournier,mot de passe cfao réinitialisé pour céline fournier,MDP CFAO,Moyenne,5.825,Incident,16,mot de passe cfao réinitialisé pour céline fournier mot de passe cfao réinitialisé pour céline fournier mot de passe cfao réinitialisé pour céline fournier
7 102,transpalette électrique problème d'alimentation tablette,transpalette électrique problème d'alimentation tablette,Utilitaires/Incident,Basse,8.85,Incident,5,transpalette électrique problème d'alimentation tablette transpalette électrique problème d'alimentation tablette
6 973_dup_44,probleme de connexion wifi maphoffice off site ainsebaa,probleme de connexion wifi maphoffice off site ainsebaa,Laptop/Request,Haute,13.33,Incident,8,probleme de connexion wifi maphoffice off site ainsebaa probleme de connexion wifi maphoffice off site ainsebaa
7 480_dup_18,problème borne ilaykom prod primaire bonjour je vous prie de noter que la borne primaire de la production ne fonctionne pas merci d'intervenir,problème borne ilaykom prod primaire,Applications,Haute,4.32,Incident,23,problème borne ilaykom prod primaire problème borne ilaykom prod primaire bonjour je vous prie de noter que la borne primaire de la production ne fonctionne pas merci d'intervenir
7 312_dup_25,imprimante hors connexion,imprimante hors connexion,Impressions & Scanner/Incident,Haute,39.5,Incident,3,imprimante hors connexion imprimante hors connexion
7 442,équipements informatiques non fonctionnels,équipements informatiques non fonctionnels,Matériel,Basse,35.0,Incident,4,équipements informatiques non fonctionnels équipements informatiques non fonctionnels
7 670_dup_5,problème boite outlook pour benmoussa deyaa problème boite outlook benmoussa deyaa,problème boite outlook pour benmoussa deyaa,Activation office,Moyenne,5.825,Incident,11,problème boite outlook pour benmoussa deyaa problème boite outlook pour benmoussa deyaa problème boite outlook benmoussa deyaa
7 683,demande de création compte ad boudchich said demande demande de création compte ad boudchich said nom de l'application materiel inf supp détaillé téléphone emplacement et numéro de bureau site zenata ou ain sebaa email,demande de création compte ad boudchich said,Compte AD,Basse,5.825,Demande,34,demande de création compte ad boudchich said demande de création compte ad boudchich said demande demande de création compte ad boudchich said nom de l'application materiel inf supp détaillé téléphone emplacement et numéro de bureau site zenata ou ain sebaa email
7 312_dup_37,imprimante hors connexion,imprimante hors connexion,Impressions & Scanner/Incident,Haute,39.5,Incident,3,imprimante hors connexion imprimante hors connexion
7 665_dup_8,problème d'accès aux partages mentionnés,problème d'accès aux partages mentionnés,Autre,Moyenne,5.825,Incident,5,problème d'accès aux partages mentionnés problème d'accès aux partages mentionnés
