ID,texte,titre,categorie,urgence,temps_resolution,type_ticket,nb_mots,text_full
7 545,acquisition d'une ligne schamel mohamed,acquisition d'une ligne schamel mohamed,Configuration tél,Basse,0.28,Demande,5,acquisition d'une ligne schamel mohamed acquisition d'une ligne schamel mohamed
7 466,problème de blocage laptop,problème de blocage laptop,Système/Incident,Basse,4.62,Incident,4,problème de blocage laptop problème de blocage laptop
7 672_dup_4,problème de okta pour kawtar zraidi problème de okta pour kawtar zraidi,problème de okta pour kawtar zraidi,MDP CFAO,Moyenne,5.825,Incident,12,problème de okta pour kawtar zraidi problème de okta pour kawtar zraidi problème de okta pour kawtar zraidi
7 677_dup_4,compte windows est verrouillé pour youssef bahaddi déverrouillage du compte windows pour youssef bahaddi,compte windows est verrouillé pour youssef bahaddi,Autre,Moyenne,5.825,Incident,14,compte windows est verrouillé pour youssef bahaddi compte windows est verrouillé pour youssef bahaddi déverrouillage du compte windows pour youssef bahaddi
7 665,problème d'accès aux partages mentionnés,problème d'accès aux partages mentionnés,Autre,Moyenne,5.825,Incident,5,problème d'accès aux partages mentionnés problème d'accès aux partages mentionnés
7 672_dup_10,problème de okta pour kawtar zraidi problème de okta pour kawtar zraidi,problème de okta pour kawtar zraidi,MDP CFAO,Moyenne,5.825,Incident,12,problème de okta pour kawtar zraidi problème de okta pour kawtar zraidi problème de okta pour kawtar zraidi
7 415,problème de connexion shimadzu n 1 lcq,problème de connexion shimadzu n 1 lcq,Bureautique/Incident,Basse,10.57,Incident,7,problème de connexion shimadzu n 1 lcq problème de connexion shimadzu n 1 lcq
7 520,demande de restauration de ce fichier svp cassfsp01 reclamation sanofi reclamations_2025 reclamations__2023 reclamations___2024,demande de restauration de ce fichier svp cassfsp01 reclamation sanofi reclamations_2025 reclamations__2023 reclamations___2024,Sauvegarde,Basse,29.77,Demande,13,demande de restauration de ce fichier svp cassfsp01 reclamation sanofi reclamations_2025 reclamations__2023 reclamations___2024 demande de restauration de ce fichier svp cassfsp01 reclamation sanofi reclamations_2025 reclamations__2023 reclamations___2024
7 139,demande accès au partage instructions de fabrication sadik fatimaezzahra,demande accès au partage instructions de fabrication sadik fatimaezzahra,Accès au partage,Basse,4.82,Demande,9,demande accès au partage instructions de fabrication sadik fatimaezzahra demande accès au partage instructions de fabrication sadik fatimaezzahra
7 665_dup_12,problème d'accès aux partages mentionnés,problème d'accès aux partages mentionnés,Autre,Moyenne,5.825,Incident,5,problème d'accès aux partages mentionnés problème d'accès aux partages mentionnés
7 423,sécurité des comptes fx0992,sécurité des comptes fx0992,Compte AD,Basse,6.15,Demande,4,sécurité des comptes fx0992 sécurité des comptes fx0992
7 657_dup_11,installation souris sans fil ã sanaa bakkaddour installation de la souris sans fil via le laptop,installation souris sans fil ã sanaa bakkaddour,Accessoires/Request,Moyenne,5.825,Demande,16,installation souris sans fil ã sanaa bakkaddour installation souris sans fil ã sanaa bakkaddour installation de la souris sans fil via le laptop
7 198,accès one drive ã donner ã salma elotmani elle a des dossiers ã envoyer ã l'agence,accès one drive ã donner ã salma elotmani elle a des dossiers ã envoyer ã l'agence,Accès au partage,Basse,49.33,Demande,16,accès one drive ã donner ã salma elotmani elle a des dossiers ã envoyer ã l'agence accès one drive ã donner ã salma elotmani elle a des dossiers ã envoyer ã l'agence
7 563,problème imprimante ma15,problème imprimante ma15,Impressions & Scanner/Incident,Basse,2.42,Incident,3,problème imprimante ma15 problème imprimante ma15
7 480_dup_45,problème borne ilaykom prod primaire bonjour je vous prie de noter que la borne primaire de la production ne fonctionne pas merci d'intervenir,problème borne ilaykom prod primaire,Applications,Haute,4.32,Incident,23,problème borne ilaykom prod primaire problème borne ilaykom prod primaire bonjour je vous prie de noter que la borne primaire de la production ne fonctionne pas merci d'intervenir
7 312_dup_60,imprimante hors connexion,imprimante hors connexion,Impressions & Scanner/Incident,Haute,39.5,Incident,3,imprimante hors connexion imprimante hors connexion
7 378,création compte ad_elazzaoui abdellah,création compte ad_elazzaoui abdellah,Création compte AD,Basse,16.43,Demande,4,création compte ad_elazzaoui abdellah création compte ad_elazzaoui abdellah
7 649,demande de de créer un nouveau dossier de partage nommé projet sérialisation sur le serveur cazsfsp02 et d'attribuer un accès en lecture et écriture ã toutes les personnes listées ci-dessous,demande de de créer un nouveau dossier de partage nommé projet sérialisation sur le serveur cazsfsp02 et d'attribuer un accès en lecture et écriture ã toutes les personnes listées ci-dessous,Autre,Basse,1.25,Demande,30,demande de de créer un nouveau dossier de partage nommé projet sérialisation sur le serveur cazsfsp02 et d'attribuer un accès en lecture et écriture ã toutes les personnes listées ci-dessous demande de de créer un nouveau dossier de partage nommé projet sérialisation sur le serveur cazsfsp02 et d'attribuer un accès en lecture et écriture ã toutes les personnes listées ci-dessous
7 357,regule demande de nous créer deux projets sous le nom surgam cp ' et ' birodigyl cp'' sur le volet '2025 validation'',regule demande de nous créer deux projets sous le nom surgam cp ' et ' birodigyl cp'' sur le volet '2025 validation'',Autre,Basse,11.32,Demande,22,regule demande de nous créer deux projets sous le nom surgam cp ' et ' birodigyl cp'' sur le volet '2025 validation'' regule demande de nous créer deux projets sous le nom surgam cp ' et ' birodigyl cp'' sur le volet '2025 validation''
7 141,demande acces aux dossiers et sous dossiers qualité pub,demande acces aux dossiers et sous dossiers qualité pub,Accès au partage,Basse,0.4,Demande,9,demande acces aux dossiers et sous dossiers qualité pub demande acces aux dossiers et sous dossiers qualité pub
7 252,probléme teams,probléme teams,Installation TEAMS,Basse,91.05,Incident,2,probléme teams probléme teams
7 492,demandes de comptes vpn maphar,demandes de comptes vpn maphar,Création compte AD,Basse,9.8,Demande,5,demandes de comptes vpn maphar demandes de comptes vpn maphar
7 258,demande d'accès réseau,demande d'accès réseau,Connexion Réseau,Basse,7.67,Demande,3,demande d'accès réseau demande d'accès réseau
7 480_dup_2,problème borne ilaykom prod primaire bonjour je vous prie de noter que la borne primaire de la production ne fonctionne pas merci d'intervenir,problème borne ilaykom prod primaire,Applications,Haute,4.32,Incident,23,problème borne ilaykom prod primaire problème borne ilaykom prod primaire bonjour je vous prie de noter que la borne primaire de la production ne fonctionne pas merci d'intervenir
7 312_dup_2,imprimante hors connexion,imprimante hors connexion,Impressions & Scanner/Incident,Haute,39.5,Incident,3,imprimante hors connexion imprimante hors connexion
7 498_dup_5,lenteur reseau wifi depuis salle tanger,lenteur reseau wifi depuis salle tanger,Autre,Moyenne,19.67,Incident,6,lenteur reseau wifi depuis salle tanger lenteur reseau wifi depuis salle tanger
7 200_dup_2,problème d'accès internet,problème d'accès internet,Connexion internet,Moyenne,38.07,Incident,3,problème d'accès internet problème d'accès internet
7 062,demande de changement de bande description demande de changement de bande nom de l'application matériels bande inf supp détaillé bande téléphone emplacement et numéro de bureau site zenata ou ain sebaa,demande de changement de bande,Changement de bande,Basse,2.63,Demande,31,demande de changement de bande demande de changement de bande description demande de changement de bande nom de l'application matériels bande inf supp détaillé bande téléphone emplacement et numéro de bureau site zenata ou ain sebaa
7 312_dup_57,imprimante hors connexion,imprimante hors connexion,Impressions & Scanner/Incident,Haute,39.5,Incident,3,imprimante hors connexion imprimante hors connexion
7 558_dup_10,demande d' accès partage marouane aaffale,demande d' accès partage marouane aaffale,Autre,Moyenne,1.23,Demande,6,demande d' accès partage marouane aaffale demande d' accès partage marouane aaffale
7 317,demande donner l'accès ã kenza lahrichi ã ce partage cassfsp01 dap_moh_payment 2023,demande donner l'accès ã kenza lahrichi ã ce partage cassfsp01 dap_moh_payment 2023,Autre,Basse,15.78,Demande,12,demande donner l'accès ã kenza lahrichi ã ce partage cassfsp01 dap_moh_payment 2023 demande donner l'accès ã kenza lahrichi ã ce partage cassfsp01 dap_moh_payment 2023
6 973_dup_58,probleme de connexion wifi maphoffice off site ainsebaa,probleme de connexion wifi maphoffice off site ainsebaa,Laptop/Request,Haute,13.33,Incident,8,probleme de connexion wifi maphoffice off site ainsebaa probleme de connexion wifi maphoffice off site ainsebaa
7 041,demande de de donner l'accès au partage ci-dessous ã ballouki hassan en modification,demande de de donner l'accès au partage ci-dessous ã ballouki hassan en modification,Accès au partage,Basse,4.33,Demande,13,demande de de donner l'accès au partage ci-dessous ã ballouki hassan en modification demande de de donner l'accès au partage ci-dessous ã ballouki hassan en modification
7 301,problème d'heure système sur mon pc,problème d'heure système sur mon pc,Matériel/Incident,Basse,41.32,Incident,6,problème d'heure système sur mon pc problème d'heure système sur mon pc
7 489_dup_5,probléme d'accés odoo,probléme d'accés odoo,Applications,Moyenne,5.95,Incident,3,probléme d'accés odoo probléme d'accés odoo
7 312_dup_1,imprimante hors connexion,imprimante hors connexion,Impressions & Scanner/Incident,Haute,39.5,Incident,3,imprimante hors connexion imprimante hors connexion
7 540,affectation modification d'une ligne téléphonique pour touhair yasmine,affectation modification d'une ligne téléphonique pour touhair yasmine,Utilitaires/Request,Basse,18.5,Demande,8,affectation modification d'une ligne téléphonique pour touhair yasmine affectation modification d'une ligne téléphonique pour touhair yasmine
7 526,titularisation _ lamraoui hanane cdi,titularisation _ lamraoui hanane cdi,Accès au partage,Basse,2.27,Demande,5,titularisation _ lamraoui hanane cdi titularisation _ lamraoui hanane cdi
7 675_dup_4,compte windows est verrouillé pour amal lamsoundi compte windows est déverrouillé pour amal lamsoundi,compte windows est verrouillé pour amal lamsoundi,Autre,Moyenne,5.825,Incident,14,compte windows est verrouillé pour amal lamsoundi compte windows est verrouillé pour amal lamsoundi compte windows est déverrouillé pour amal lamsoundi
6 964,regule réinitialiser le mot de passe du compte spectre uv,regule réinitialiser le mot de passe du compte spectre uv,Activation compte HTDS de UV365,Basse,0.1,Demande,10,regule réinitialiser le mot de passe du compte spectre uv regule réinitialiser le mot de passe du compte spectre uv
6 996,manque réseau wifi,manque réseau wifi,Laptop/Request,Basse,8.62,Incident,3,manque réseau wifi manque réseau wifi
7 366,demande de configurer vlan 114 sur le port switch sur lequel connecté cet équipement,demande de configurer vlan 114 sur le port switch sur lequel connecté cet équipement,Connexion internet,Basse,8.6,Demande,14,demande de configurer vlan 114 sur le port switch sur lequel connecté cet équipement demande de configurer vlan 114 sur le port switch sur lequel connecté cet équipement
7 668_dup_10,mot de passe cfao réinitialisé pour céline fournier mot de passe cfao réinitialisé pour céline fournier,mot de passe cfao réinitialisé pour céline fournier,MDP CFAO,Moyenne,5.825,Incident,16,mot de passe cfao réinitialisé pour céline fournier mot de passe cfao réinitialisé pour céline fournier mot de passe cfao réinitialisé pour céline fournier
7 480_dup_12,problème borne ilaykom prod primaire bonjour je vous prie de noter que la borne primaire de la production ne fonctionne pas merci d'intervenir,problème borne ilaykom prod primaire,Applications,Haute,4.32,Incident,23,problème borne ilaykom prod primaire problème borne ilaykom prod primaire bonjour je vous prie de noter que la borne primaire de la production ne fonctionne pas merci d'intervenir
7 667,demande créer des dossiers sur le partage cazsfsp02 projet sérialisation,demande créer des dossiers sur le partage cazsfsp02 projet sérialisation,Autre,Basse,5.825,Demande,10,demande créer des dossiers sur le partage cazsfsp02 projet sérialisation demande créer des dossiers sur le partage cazsfsp02 projet sérialisation
7 480_dup_22,problème borne ilaykom prod primaire bonjour je vous prie de noter que la borne primaire de la production ne fonctionne pas merci d'intervenir,problème borne ilaykom prod primaire,Applications,Haute,4.32,Incident,23,problème borne ilaykom prod primaire problème borne ilaykom prod primaire bonjour je vous prie de noter que la borne primaire de la production ne fonctionne pas merci d'intervenir
6 987,demande accès au partage stage pfe hse,demande accès au partage stage pfe hse,Autre,Basse,9.85,Demande,7,demande accès au partage stage pfe hse demande accès au partage stage pfe hse
7 159,probleme accès ã ma base documentaire juridique editions francis lefebvre,probleme accès ã ma base documentaire juridique editions francis lefebvre,Applications,Haute,98.92,Incident,10,probleme accès ã ma base documentaire juridique editions francis lefebvre probleme accès ã ma base documentaire juridique editions francis lefebvre
7 439,demande d'augmenter la capacité de ce dossier partagé,demande d'augmenter la capacité de ce dossier partagé,Accès au partage,Basse,10.08,Demande,8,demande d'augmenter la capacité de ce dossier partagé demande d'augmenter la capacité de ce dossier partagé
7 159_dup_9,probleme accès ã ma base documentaire juridique editions francis lefebvre,probleme accès ã ma base documentaire juridique editions francis lefebvre,Applications,Haute,98.92,Incident,10,probleme accès ã ma base documentaire juridique editions francis lefebvre probleme accès ã ma base documentaire juridique editions francis lefebvre
7 480_dup_40,problème borne ilaykom prod primaire bonjour je vous prie de noter que la borne primaire de la production ne fonctionne pas merci d'intervenir,problème borne ilaykom prod primaire,Applications,Haute,4.32,Incident,23,problème borne ilaykom prod primaire problème borne ilaykom prod primaire bonjour je vous prie de noter que la borne primaire de la production ne fonctionne pas merci d'intervenir
7 176,régularisation demande de créer le projet dogmatil gélule pf pour 2025,régularisation demande de créer le projet dogmatil gélule pf pour 2025,Création de projet,Basse,5.825,Demande,11,régularisation demande de créer le projet dogmatil gélule pf pour 2025 régularisation demande de créer le projet dogmatil gélule pf pour 2025
7 599,demande d'activation compte windows,demande d'activation compte windows,accès Windows,Basse,3.95,Demande,4,demande d'activation compte windows demande d'activation compte windows
7 172,demande de déconnecter l'user e000081,demande de déconnecter l'user e000081,Compte SAP,Basse,5.825,Demande,5,demande de déconnecter l'user e000081 demande de déconnecter l'user e000081
7 663_dup_1,mot de passe cfao réinitialisé pour céline fournier mot de passe cfao réinitialisé pour céline fournier,mot de passe cfao réinitialisé pour céline fournier,MDP CFAO,Moyenne,5.825,Demande,16,mot de passe cfao réinitialisé pour céline fournier mot de passe cfao réinitialisé pour céline fournier mot de passe cfao réinitialisé pour céline fournier
7 603,blocage du compte,blocage du compte,Système/Incident,Basse,15.43,Incident,3,blocage du compte blocage du compte
7 085,demande de changement de bande description demande de changement de bande nom de l'application matériels bande inf supp détaillé bande téléphone emplacement et numéro de bureau site zenata ou ain sebaa,demande de changement de bande,Changement de bande,Basse,13.02,Demande,31,demande de changement de bande demande de changement de bande description demande de changement de bande nom de l'application matériels bande inf supp détaillé bande téléphone emplacement et numéro de bureau site zenata ou ain sebaa
6 973_dup_33,probleme de connexion wifi maphoffice off site ainsebaa,probleme de connexion wifi maphoffice off site ainsebaa,Laptop/Request,Haute,13.33,Incident,8,probleme de connexion wifi maphoffice off site ainsebaa probleme de connexion wifi maphoffice off site ainsebaa
7 670_dup_16,problème boite outlook pour benmoussa deyaa problème boite outlook benmoussa deyaa,problème boite outlook pour benmoussa deyaa,Activation office,Moyenne,5.825,Incident,11,problème boite outlook pour benmoussa deyaa problème boite outlook pour benmoussa deyaa problème boite outlook benmoussa deyaa
7 022,regule compte sap est bloqué i0271088,regule compte sap est bloqué i0271088,Autre,Basse,0.88,Demande,6,regule compte sap est bloqué i0271088 regule compte sap est bloqué i0271088
7 256_dup_41,problèmes de connexion,problèmes de connexion,Bureautique/Incident,Haute,151.17,Incident,3,problèmes de connexion problèmes de connexion
7 314,demande de desactiver le compte ad de meryem et supprimer ces 2 malwares puis faire un scan,demande de desactiver le compte ad de meryem et supprimer ces 2 malwares puis faire un scan,Compte AD désactivation,Basse,22.25,Demande,17,demande de desactiver le compte ad de meryem et supprimer ces 2 malwares puis faire un scan demande de desactiver le compte ad de meryem et supprimer ces 2 malwares puis faire un scan
7 510,probléme demarrage du poste pour m khirlah youssef,probléme demarrage du poste pour m khirlah youssef,Impressions Scanner Request,Basse,0.18,Incident,8,probléme demarrage du poste pour m khirlah youssef probléme demarrage du poste pour m khirlah youssef
7 278,probleme d'acces session windows expiré salma haidane,probleme d'acces session windows expiré salma haidane,accès Windows,Basse,0.75,Incident,7,probleme d'acces session windows expiré salma haidane probleme d'acces session windows expiré salma haidane
6 973_dup_31,probleme de connexion wifi maphoffice off site ainsebaa,probleme de connexion wifi maphoffice off site ainsebaa,Laptop/Request,Haute,13.33,Incident,8,probleme de connexion wifi maphoffice off site ainsebaa probleme de connexion wifi maphoffice off site ainsebaa
7 333_dup_4,problème de téléphonie-coupures réseau,problème de téléphonie-coupures réseau,Applications,Moyenne,23.35,Incident,4,problème de téléphonie-coupures réseau problème de téléphonie-coupures réseau
7 374,problème d'accès au partage cassfp01 apg_pub fichier ar references,problème d'accès au partage cassfp01 apg_pub fichier ar references,Accès au partage,Basse,10.85,Incident,9,problème d'accès au partage cassfp01 apg_pub fichier ar references problème d'accès au partage cassfp01 apg_pub fichier ar references
7 312_dup_43,imprimante hors connexion,imprimante hors connexion,Impressions & Scanner/Incident,Haute,39.5,Incident,3,imprimante hors connexion imprimante hors connexion
7 398,failed cas_cassfsp01_prd_bkp_tape 1 machines 1 failed,failed cas_cassfsp01_prd_bkp_tape 1 machines 1 failed,Sauvegarde,Basse,19.63,Incident,6,failed cas_cassfsp01_prd_bkp_tape 1 machines 1 failed failed cas_cassfsp01_prd_bkp_tape 1 machines 1 failed
7 676_dup_12,installation microsoft office 365 via laptop de ghafir el idrissi el bachir installation microsoft office 365 via laptop de ghafir el idrissi el bachir,installation microsoft office 365 via laptop de ghafir el idrissi el bachir,Autre,Moyenne,5.825,Incident,24,installation microsoft office 365 via laptop de ghafir el idrissi el bachir installation microsoft office 365 via laptop de ghafir el idrissi el bachir installation microsoft office 365 via laptop de ghafir el idrissi el bachir
7 500,user bloqué oumaima kasmi,user bloqué oumaima kasmi,Bureautique/Incident,Basse,1.12,Incident,4,user bloqué oumaima kasmi user bloqué oumaima kasmi
7 602,test de restauration des données lims,test de restauration des données lims,Sauvegarde,Basse,14.45,Demande,6,test de restauration des données lims test de restauration des données lims
7 490,compatibilité windows 11 vs excel 2016,compatibilité windows 11 vs excel 2016,Bureautique/Incident,Basse,10.78,Incident,6,compatibilité windows 11 vs excel 2016 compatibilité windows 11 vs excel 2016
7 269,audit deloitte,audit deloitte,Compte AD,Basse,17.23,Demande,2,audit deloitte audit deloitte
7 425,problème pc portable,problème pc portable,Système/Incident,Basse,17.85,Incident,3,problème pc portable problème pc portable
7 256_dup_49,problèmes de connexion,problèmes de connexion,Bureautique/Incident,Haute,151.17,Incident,3,problèmes de connexion problèmes de connexion
7 032,regule crée le projet rovamycine sur citrix,regule crée le projet rovamycine sur citrix,Autre,Basse,1.43,Demande,7,regule crée le projet rovamycine sur citrix regule crée le projet rovamycine sur citrix
7 246,demande accès ã l'imprimante zebra,demande accès ã l'imprimante zebra,Accessoires/Request,Basse,161.7,Demande,5,demande accès ã l'imprimante zebra demande accès ã l'imprimante zebra
7 194,pb expiration du compte windows,pb expiration du compte windows,accès Windows,Basse,13.48,Incident,5,pb expiration du compte windows pb expiration du compte windows
7 007,demande de creer le projet birodogyl cp_2025,demande de creer le projet birodogyl cp_2025,Création de projet,Basse,5.825,Demande,7,demande de creer le projet birodogyl cp_2025 demande de creer le projet birodogyl cp_2025
7 674_dup_10,aicha ikhrichi peut pas accéder ã onedrive aicha ikhrichi peut pas accéder ã onedrive,aicha ikhrichi peut pas accéder ã onedrive,Autre,Moyenne,5.825,Incident,14,aicha ikhrichi peut pas accéder ã onedrive aicha ikhrichi peut pas accéder ã onedrive aicha ikhrichi peut pas accéder ã onedrive
7 655_dup_3,installation souris sans fil ã bouchra eljamii installation de la souris sans fil ã bouchra eljamii,installation souris sans fil ã bouchra eljamii,Accessoires/Request,Moyenne,19.33,Demande,16,installation souris sans fil ã bouchra eljamii installation souris sans fil ã bouchra eljamii installation de la souris sans fil ã bouchra eljamii
7 392_dup_13,téléphone fixe hors service,téléphone fixe hors service,Applications,Haute,44.27,Incident,4,téléphone fixe hors service téléphone fixe hors service
7 066,demande accès fichiers suivi réclamations sanofi,demande accès fichiers suivi réclamations sanofi,Autre,Basse,11.57,Demande,6,demande accès fichiers suivi réclamations sanofi demande accès fichiers suivi réclamations sanofi
7 625_dup_1,problèmes techniques sur mon pc ayoub sadkou,problèmes techniques sur mon pc ayoub sadkou,Autre,Moyenne,27.3,Incident,7,problèmes techniques sur mon pc ayoub sadkou problèmes techniques sur mon pc ayoub sadkou
7 200_dup_6,problème d'accès internet,problème d'accès internet,Connexion internet,Moyenne,38.07,Incident,3,problème d'accès internet problème d'accès internet
7 071,probleme d'accès aux liens wetransfer ni aux différents sharepoint,probleme d'accès aux liens wetransfer ni aux différents sharepoint,Applications,Basse,9.47,Incident,9,probleme d'accès aux liens wetransfer ni aux différents sharepoint probleme d'accès aux liens wetransfer ni aux différents sharepoint
7 162_dup_9,affectation d'une ligne téléphonique pour haitam kerbane,affectation d'une ligne téléphonique pour haitam kerbane,Utilitaires/Request,Moyenne,66.68,Demande,7,affectation d'une ligne téléphonique pour haitam kerbane affectation d'une ligne téléphonique pour haitam kerbane
7 272,demende d'augmentation de la taille du projet,demende d'augmentation de la taille du projet,Augmentation de taille,Basse,9.6,Demande,7,demende d'augmentation de la taille du projet demende d'augmentation de la taille du projet
7 079,demande de créer sur swift projet haldol 2025,demande de créer sur swift projet haldol 2025,Création de projet,Basse,5.825,Demande,8,demande de créer sur swift projet haldol 2025 demande de créer sur swift projet haldol 2025
7 670_dup_4,problème boite outlook pour benmoussa deyaa problème boite outlook benmoussa deyaa,problème boite outlook pour benmoussa deyaa,Activation office,Moyenne,5.825,Incident,11,problème boite outlook pour benmoussa deyaa problème boite outlook pour benmoussa deyaa problème boite outlook benmoussa deyaa
6 920,demande créer le projet propranolol_2025 et le projet levocetirizine dihydrochloride_2025 sur citrix 2024 pour mp,demande créer le projet propranolol_2025 et le projet levocetirizine dihydrochloride_2025 sur citrix 2024 pour mp,Création de projet,Basse,5.825,Demande,15,demande créer le projet propranolol_2025 et le projet levocetirizine dihydrochloride_2025 sur citrix 2024 pour mp demande créer le projet propranolol_2025 et le projet levocetirizine dihydrochloride_2025 sur citrix 2024 pour mp
